Order,Ibn Hisham text,Ibn Hisham UI,Column1,Tabari Text,Tabari UI,Column2,Ibn Sa'd Text,Ibn Sa'd UI,Column3,Section of storyline,Column4,Importance,Total PRI
1,,,,,,,ذكر بيوت رسول الله - صلى الله عليه وسلم - وحجر أزواجه,1.108.0.0.0,,Maghazi,,SEC,8
2,,,,,,,ذكر بناء رسول الله - صلى الله عليه وسلم - المسجد بالمدينة,1.64.0.0.0,,Maghazi,,PRI,
3,خبر الأذان,118.0.0,,,,,ذكر الأذان,1.67.0.0.0,,Maghazi,,SEC,
4,,,,خطبه رسول الله ص في أول جمعة جمعها بالمدينة,3.8.1.0,,,,,Maghazi,,SEC,
5,غزوة ودان وهي أول غزواته عليه الصلاة والسلام ,131.0.0,,,,,,,,Maghazi,,SEC,
6,صرف القبلة إلى الكعبة,139.0.0,,,,,ذكر صرف القبلة عن بيت المقدس إلى الكعبة,1.65.0.0.0,,Maghazi,,SEC,
7,,,,,,,ذكر فرض شهر رمضان وزكاة الفطر وصلاة العيدين وسنة الأضحية,1.68.0.0.0,,Maghazi,,SEC,
8, غزوة بدر الكبرى,140.0.0,,ذكر وقعة بدر الكبرى,3.9.4.0,,غزوة بدر ,2.1.8.0.0,,Maghazi,,PRI,
9,نزول سورة الأنفال,147.0.0,,,,,,,,Maghazi,,SEC,
10,أمر بني قينقاع,158.0.0,,غزوة بني قينقاع,3.9.5.0,,,,,Maghazi,,SEC,
11,غزوة أحد,162.0.0,,غزوة أحد,3.10.5.0,,غزوة رسول الله - صلى الله عليه وسلم - أحدا «1»,2.1.18.0.0,,Maghazi,,PRI,
12,أمر إجلاء بني النضير في سنة أربع,169.0.0,,ذكر خبر جلاء بني النضير,3.11.4.0,,غزوة رسول الله - صلى الله عليه وسلم - بني النضير «1»,2.1.24.1.0,,Maghazi,,SEC,
13,غزوة دومة الجندل في شهر ربيع الأول سنة خمس,172.0.0,,,,,,,,Maghazi,,SEC,
14,,,,ففي هذه السنه تزوج رسول الله ص زينب بنت جحش,3.12.1.0,,,,,Maghazi,,SEC,
15,غزوة الخندق [1] في شوال سنة خمس,173.0.0,,ذكر الخبر عن غزوة الخندق,3.12.3.0,,غزوة رسول الله - صلى الله عليه وسلم - الخندق وهي غزوة الأحزاب»,2.1.29.1.0,,Maghazi,,PRI,
16,أمر الحديبية,182.0.0,,"ذكر الخبر عن عمره النبي ص التي صده المشركون فيها عن البيت، وهي قصة الحديبية",3.13.5,,غزوة رسول الله - صلى الله عليه وسلم - الحديبية «1»,2.1.49.1.0,,Maghazi,,SEC,
17,أمر الهدنة,184.0.0,,,,,,,,Maghazi,,SEC,
18, بقية أمر خيبر,188.0.0,,غزوة خيبر,4.1.1.0,,غزوة رسول الله - صلى الله عليه وسلم - خيبر «1»,2.1.50.1.0,,Maghazi,,SEC,
19,ذكر قدوم جعفر بن أبي طالب من الحبشة وحديث المهاجرين إلى الحبشة ,194.0.0,,,,,,,,Maghazi,,SEC,
20,"ذكر غزوة مؤتة [1] في جمادى الأولى سنة ثمان، ومقتل جعفر وزيد وعبد الله بن رواحة ",196.0.0,,ذكر الخبر عن غزوة مؤتة,4.2.7.0,,سرية مؤتة,2.1.62.1.0,,Maghazi,,SEC,
21,ذكر الأسباب الموجبة المسير إلى مكة وذكر فتح مكة في شهر رمضان سنة ثمان,197.0.0,,ذكر الخبر عن فتح مكة,4.2.8.0,,غزوة رسول الله - صلى الله عليه وسلم - عام الفتح «1»,2.1.67.1.0,,Maghazi,,PRI,
22,غزوة حنين في سنة ثمان بعد الفتح,201.0.0,,,,,غزوة رسول الله - صلى الله عليه وسلم - إلى حنين «1»,2.1.72.1.0,,Maghazi,,SEC,
23,ذكر غزوة الطائف بعد حنين في سنة ثمان,202.0.0,, غزوه الطائف,4.2.12.0,,غزوة رسول الله - صلى الله عليه وسلم - الطائف «1»,2.1.74.1.0,,Maghazi,,SEC,
24,,,,عمرة رسول الله من الجعرانة,4.2.14.0,,ذكر عمرة النبي- صلى الله عليه وسلم -,2.1.85.1.0,,Maghazi,,SEC,
25,غزوة تبوك في رجب سنة تسع,206.0.0,,ذكر الخبر عن غزوة تبوك,4.3.2.0,,غزوة رسول الله - صلى الله عليه وسلم - تبوك «1»,2.1.81.1.0,,Maghazi,,SEC,
26,,,,قدوم رسول ملوك حمير على رسول الله بكتابهم,4.3.5.0,,,,,Maghazi,,SEC,
27,أمر وفد ثقيف وإسلامها في شهر رمضان سنة تسع,209.0.0,,,,,,,,Maghazi,,SEC,
28,,,,كتاب مسيلمه الى رسول الله والجواب عنه,4.4.14.0,,,,,Maghazi,,SEC,
29,وصية الرسول معاذا حين بعثه إلى اليمن,225.0.0,,,,,,,,Maghazi,,SEC,
30,,,,,,,حجة أبي بكر الصديق بالناس «1»,2.1.82.1.0,,Maghazi,,SEC,
31,حجة الوداع,233.0.0,,حجه الوداع,4.4.16.0,,حجة الوداع,2.1.86.1.0,,Maghazi,,PRI,
32,سرية زيد بن حارثة إلى مدين,252.0.0,,,,,,,,Maghazi,,SEC,
33, غزوة علي بن أبي طالب إلى اليمن,258.0.0,,سريه على بن ابى طالب الى اليمن,4.4.4.0,,,,,Maghazi,,SEC,
34,بعث أسامة بن زيد إلى أرض فلسطين وهو آخر البعوث,259.0.0,,,,,سرية أسامة بن زيد بن حارثة «2»,2.1.87.1.0,,Maghazi,,SEC,
35,,,,,,,ذكر عرض رسول الله - صلى الله عليه وسلم - القرآن على جبريل واعتكافه في السنة التي قبض فيها,2.3.0.0.0,,Maghazi,,SEC,
36,,,,,,,ذكر خروج رسول الله - صلى الله عليه وسلم - إلى البقيع واستغفاره لأهله والشهداء,2.6.0.0.0,,Maghazi,,SEC,
37,ابتداء شكوى رسول الله صلى الله عليه وسلم,260.0.0,,ذكر الخبر عن بدء مرض رسول الله الذي توفي فيه وما كان منه قبيل ذلك لما نعيت اليه نفسه ص,4.4.41.0,,ذكر أول ما بدأ برسول الله - صلى الله عليه وسلم - وجعه الذي توفى فيه,2.7.0.0.0,,Maghazi,,SEC,
38,ذكر أزواجه صلى الله عليه وسلم أمهات المؤمنين,261.0.0,,ذكر الخبر عن أزواج رسول الله ص,4.4.21.0,,,,,Maghazi,,SEC,
39,,,,,,,ذكر صلاة رسول الله - صلى الله عليه وسلم - بأصحابه في مرضه,2.10.0.0.0,,Maghazi,,SEC,
40,,,,,,,ذكر ما قال رسول الله - صلى الله عليه وسلم - لفاطمة ابنته في مرضه.صلوات الله عليهما وسلامه,2.23.0.0.0,,Maghazi,,SEC,
41,تمريض رسول الله في بيت عائشة,262.0.0,,,,,ذكر استئذان رسول الله - صلى الله عليه وسلم - نساءه أن يمرض في بيت عائشة,2.16.0.0.0,,Maghazi,,SEC,
42,,,,,,,ذكر وفاة رسول الله- صلى الله عليه وسلم -,2.28.0.0.0,,Maghazi,,PRI,
43,جهاز رسول الله صلى الله عليه وسلم ودفنه,264.0.0,,ذكر جهاز رسول الله ص ودفنه,4.6.2.0,,,,,Maghazi,,PRI,
44,,,,ذكر صفه النبي ص,4.4.37.0,,ذكر صفة أخلاق رسول الله- صلى الله عليه وسلم -,1.75.0.0.0,,Maghazi,,SEC,
45,,,,,,,باب صفة قراءته - صلى الله عليه وسلم - في صلاته وغيرها وحسن صوته- صلى الله عليه وسلم -,1.75.4.0.0,,Maghazi,,SEC,
46,,,,,,,ذكر صفته - صلى الله عليه وسلم - في خطبته,1.75.5.0.0,,Maghazi,,SEC,
47,,,,,,, ذكر محاسن أخلاقه- صلى الله عليه وسلم -,1.75.9.0.0,,Maghazi,,SEC,
48,,,,,,, ذكر صلاة رسول الله- صلى الله عليه وسلم -,1.75.10.0.0,,Maghazi,,SEC,
49,,,,,,, ذكر طعام رسول الله - صلى الله عليه وسلم - وما كان يعجبه منه,1.75.12.0.0,,Maghazi,,SEC,
50,,,,,,, ذكر خاتم النبوة الذي كان بين كتفي رسول الله- صلى الله عليه وسلم -,1.77.1.0.0,,Maghazi,,SEC,
51,,,,,,, ذكر لباس رسول الله - صلى الله عليه وسلم - وما روي في البياض,1.82.0.0.0,,Maghazi,,SEC,
52,,,,أسماء خيل رسول الله ص,4.4.27.0,,,,,Maghazi,,SEC,
53,,,,ذكر أسماء سيوف رسول الله ص,4.4.32.0,,ذكر سيوف رسول الله- صلى الله عليه وسلم -,1.99.0.0.0,,Maghazi,,SEC,
54,,,, ذكر أسماء رسول الله ص,4.4.36.0,,ذكر ما سم به رسول الله- صلى الله عليه وسلم -,2.5.0.0.0,,Maghazi,,SEC,
