Column1,Column2,Column3,Column4
Heading title,Old UI,New UI,Older UI
### | [الجزء الأول] - السيرة النبوية الشريفة ,1.0.0.0.0,1.0.0.0.0,1.0.0.0.0
### || ذكر من انتمى إليه رسول الله- صلى الله عليه وسلم - ,1.1.0.0.0,1.1.0.0.0,1.1.0.0.0
### || ذكر من ولد رسول الله - صلى الله عليه وسلم - من الأنبياء ,1.2.0.0.0,1.2.0.0.0,1.2.0.0.0
### || ذكر حواء ,1.3.0.0.0,1.3.0.0.0,1.3.0.0.0
### || ذكر إدريس النبي ص. ,1.4.0.0.0,1.4.0.0.0,1.4.0.0.0
### || ذكر نوح النبي ص. ,1.5.0.0.0,1.5.0.0.0,1.5.0.0.0
### || ذكر إبراهيم خليل الرحمن-  ,1.6.0.0.0,1.6.0.0.0,1.6.0.0.0
### || ذكر إسماعيل. ع ,1.7.0.0.0,1.7.0.0.0,1.7.0.0.0
### || ذكر القرون والسنين التي بين آدم ومحمد. عليهما الصلاة والسلام قال: ,1.8.0.0.0,1.8.0.0.0,1.8.0.0.0
### || ذكر تسمية الأنبياء وأنسابهم - صلى الله عليه وسلم - ,1.9.0.0.0,1.9.0.0.0,1.9.0.0.0
### || ذكر نسب رسول الله - صلى الله عليه وسلم - وتسمية من ولده إلى آدم- صلى ,1.10.0.0.0,1.10.0.0.0,1.10.0.0.0
### || ذكر أمهات رسول الله. عليه الصلاة والسلام ,1.11.0.0.0,1.11.0.0.0,1.11.0.0.0
### || ذكر الفواطم والعواتك اللاتي ولدن رسول الله- صلى الله عليه وسلم - ,1.12.0.0.0,1.12.0.0.0,1.12.0.0.0
### || ذكر أمهات آباء رسول الله- صلى الله عليه وسلم - قال: أخبرنا هشام بن ,1.13.0.0.0,1.13.0.0.0,1.13.0.0.0
### || ذكر قصي بن كلاب ,1.14.0.0.0,1.14.0.0.0,1.14.0.0.0
### || ذكر عبد مناف بن قصي ,1.15.0.0.0,1.15.0.0.0,1.15.0.0.0
### || ذكر هاشم بن عبد مناف ,1.16.0.0.0,1.16.0.0.0,1.16.0.0.0
### || ذكر عبد المطلب بن هاشم ,1.17.0.0.0,1.17.0.0.0,1.17.0.0.0
### || ذكر نذر عبد المطلب أن ينحر ابنه ,1.18.0.0.0,1.18.0.0.0,1.18.0.0.0
### || ذكر تزوج عبد الله بن عبد المطلب آمنة بنت وهب أم رسول الله- صلى الله عليه وسلم - ,1.19.0.0.0,1.19.0.0.0,1.19.0.0.0
### || ذكر المرأة التي عرضت نفسها على عبد الله بن عبد المطلب ,1.20.0.0.0,1.20.0.0.0,1.20.0.0.0
### || ذكر حمل آمنة برسول الله- صلى الله عليه وسلم - كثيرا ,1.21.0.0.0,1.21.0.0.0,1.21.0.0.0
### || ذكر وفاة عبد الله بن عبد المطلب ,1.22.0.0.0,1.22.0.0.0,1.22.0.0.0
### || ذكر مولد رسول الله- صلى الله عليه وسلم - ,1.23.0.0.0,1.23.0.0.0,1.23.0.0.0
### || ذكر أسماء الرسول - صلى الله عليه وسلم - وكنيته ,1.24.0.0.0,1.24.0.0.0,1.24.0.0.0
### || ذكر كنية رسول الله- صلى الله عليه وسلم - ,1.25.0.0.0,1.25.0.0.0,1.25.0.0.0
### || ذكر من أرضع رسول الله- صلى الله عليه وسلم - وتسمية إخوته وأخواته من ,1.26.0.0.0,1.26.0.0.0,1.26.0.0.0
### || ذكر وفاة آمنة أم رسول الله- صلى الله عليه وسلم - ,1.27.0.0.0,1.27.0.0.0,1.27.0.0.0
### || ذكر ضم عبد المطلب رسول الله - صلى الله عليه وسلم - إليه بعد وفاة أمه ,1.28.0.0.0,1.28.0.0.0,1.28.0.0.0
### || ذكر أبي طالب وضمه رسول الله- صلى الله عليه وسلم - إليه وخروجه معه  إلى الشام في المرة الأولى ,1.29.0.0.0,1.29.0.0.0,1.29.0.0.0
### || ذكر رعية رسول الله - صلى الله عليه وسلم - الغنم بمكة ,1.30.0.0.0,1.30.0.0.0,1.30.0.0.0
### || ذكر حضور رسول الله - صلى الله عليه وسلم - حرب الفجار ,1.31.0.0.0,1.31.0.0.0,1.31.0.0.0
### || ذكر حضور رسول الله - صلى الله عليه وسلم - حلف الفضول ,1.32.0.0.0,1.32.0.0.0,1.32.0.0.0
### || ذكر خروج رسول الله - صلى الله عليه وسلم - إلى الشأم في المرة الثانية ,1.33.0.0.0,1.33.0.0.0,1.33.0.0.0
### || ذكر تزويج رسول الله - صلى الله عليه وسلم - خديجة بنت خويلد ,1.34.0.0.0,1.34.0.0.0,1.34.0.0.0
### || ذكر أولاد رسول الله - صلى الله عليه وسلم - وتسميتهم ,1.35.0.0.0,1.35.0.0.0,1.35.0.0.0
### || ذكر إبراهيم بن رسول الله. صلى الله عليه وسلم تسليما ,1.36.0.0.0,1.36.0.0.0,1.36.0.0.0
### || ذكر حضور رسول الله- صلى الله عليه وسلم - هدم قريش الكعبة وبناءها ,1.37.0.0.0,1.37.0.0.0,1.37.0.0.0
### || ذكر نبوة رسول الله- صلى الله عليه وسلم - ,1.38.0.0.0,1.38.0.0.0,1.38.0.0.0
### || ذكر علامات النبوة في رسول الله- صلى الله عليه وسلم - قبل أن يوحى إليه ,1.39.0.0.0,1.39.0.0.0,1.39.0.0.0
### || ذكر من تسمى في الجاهلية بمحمد رجاء أن تدركه النبوة للذي كان من خبرها ,1.40.0.0.0,1.40.0.0.0,1.40.0.0.0
### || ذكر علامات النبوة بعد نزول الوحي على رسول الله- صلى الله عليه وسلم - ,1.41.0.0.0,1.41.0.0.0,1.41.0.0.0
### || ذكر مبعث رسول الله - صلى الله عليه وسلم - وما بعث به ,1.42.0.0.0,1.42.0.0.0,1.42.0.0.0
### || ذكر اليوم الذي بعث فيه رسول الله ص. ,1.43.0.0.0,1.43.0.0.0,1.43.0.0.0
### || ذكر نزول الوحي على رسول الله- صلى الله عليه وسلم - ,1.44.0.0.0,1.44.0.0.0,1.44.0.0.0
### || ذكر أول ما نزل عليه من القرآن وما قيل له- صلى الله عليه وسلم - ,1.45.0.0.0,1.45.0.0.0,1.45.0.0.0
### || ذكر شدة نزول الوحي على النبي- صلى الله عليه وسلم - ,1.46.0.0.0,1.46.0.0.0,1.46.0.0.0
### || ذكر دعاء رسول الله - صلى الله عليه وسلم - الناس إلى الإسلام ,1.47.0.0.0,1.47.0.0.0,1.47.0.0.0
### || ذكر ممشى قريش إلى أبي طالب في أمره- صلى الله عليه وسلم - ,1.48.0.0.0,1.48.0.0.0,1.48.0.0.0
### || ذكر هجرة من هاجر من أصحاب رسول الله- صلى الله عليه وسلم - إلى أرض الحبشة في المرة الأولى ,1.49.0.0.0,1.49.0.0.0,1.49.0.0.0
### || ذكر سبب رجوع أصحاب النبي- صلى الله عليه وسلم - من أرض الحبشة ,1.50.0.0.0,1.50.0.0.0,1.50.0.0.0
### || ذكر الهجرة الثانية إلى أرض الحبشة ,1.51.0.0.0,1.51.0.0.0,1.51.0.0.0
### || ذكر حصر قريش رسول الله- صلى الله عليه وسلم - وبني هاشم في الشعب ,1.52.0.0.0,1.52.0.0.0,1.52.0.0.0
### || ذكر سبب خروج رسول الله- صلى الله عليه وسلم - إلى الطائف ,1.53.0.0.0,1.53.0.0.0,1.53.0.0.0
### || ذكر المعراج وفرض الصلوات ,1.54.0.0.0,1.54.0.0.0,1.54.0.0.0
### || ذكر ليلة أسري برسول الله - صلى الله عليه وسلم - إلى بيت المقدس ,1.55.0.0.0,1.55.0.0.0,1.55.0.0.0
### || ذكر دعاء رسول الله - صلى الله عليه وسلم - قبائل العرب في المواسم ,1.56.0.0.0,1.56.0.0.0,1.56.0.0.0
### || ذكر دعاء رسول الله - صلى الله عليه وسلم - الأوس والخزرج ,1.57.0.0.0,1.57.0.0.0,1.57.0.0.0
### || ذكر العقبة الأولى الاثني عشر ,1.58.0.0.0,1.58.0.0.0,1.58.0.0.0
### || ذكر العقبة الآخرة وهم السبعون الذين بايعوا رسول الله ص. ,1.59.0.0.0,1.59.0.0.0,1.59.0.0.0
### || ذكر مقام رسول الله- صلى الله عليه وسلم - بمكة من حين تنبأ إلى الهجرة ,1.60.0.0.0,1.60.0.0.0,1.60.0.0.0
### || ذكر إذن رسول الله - صلى الله عليه وسلم - للمسلمين في الهجرة إلى المدينة ,1.61.0.0.0,1.61.0.0.0,1.61.0.0.0
### || ذكر خروج رسول الله - صلى الله عليه وسلم - وأبي بكر إلى المدينة للهجرة ,1.62.0.0.0,1.62.0.0.0,1.62.0.0.0
### || ذكر مؤاخاة رسول الله - صلى الله عليه وسلم - بين المهاجرين والأنصار ,1.63.0.0.0,1.63.0.0.0,1.63.0.0.0
### || ذكر بناء رسول الله - صلى الله عليه وسلم - المسجد بالمدينة ,1.64.0.0.0,1.64.0.0.0,1.64.0.0.0
### || ذكر صرف القبلة عن بيت المقدس إلى الكعبة ,1.65.0.0.0,1.65.0.0.0,1.65.0.0.0
### || ذكر المسجد الذي أسس على التقوى ,1.66.0.0.0,1.66.0.0.0,1.66.0.0.0
### || ذكر الأذان ,1.67.0.0.0,1.67.0.0.0,1.67.0.0.0
### || ذكر فرض شهر رمضان وزكاة الفطر وصلاة العيدين وسنة الأضحية ,1.68.0.0.0,1.68.0.0.0,1.68.0.0.0
### || ذكر منبر رسول الله- صلى الله عليه وسلم - ,1.69.0.0.0,1.69.0.0.0,1.69.0.0.0
### || ذكر الصفة ومن كان فيها من أصحاب النبي- صلى الله عليه وسلم - ,1.70.0.0.0,1.70.0.0.0,1.70.0.0.0
### || ذكر الموضع الذي كان يصلي فيه رسول الله  - صلى الله عليه وسلم - على الجنائز ,1.71.0.0.0,1.71.0.0.0,1.71.0.0.0
### || ذكر بعثة رسول الله - صلى الله عليه وسلم - الرسل بكتبه إلى الملوك يدعوهم إلى الإسلام وما كتب به رسول الله - صلى الله عليه وسلم - لناس من العرب وغيرهم ,1.72.0.0.0,1.72.0.0.0,1.72.0.0.0
### || ذكر وفادات العرب على رسول الله- صلى الله عليه وسلم - ,1.73.0.0.0,1.73.0.0.0,1.73.0.0.0
### ||| وفد مزينة ,1.73.1.0.0,1.73.1.0.0,1.73.1.0.0
### ||| وفد أسد ,1.73.2.0.0,1.73.2.0.0,1.73.2.0.0
### ||| وفد تميم ,1.73.3.0.0,1.73.3.0.0,1.73.3.0.0
### ||| وفد عبس ,1.73.4.0.0,1.73.4.0.0,1.73.4.0.0
### ||| وفد فزارة ,1.73.5.0.0,1.73.5.0.0,1.73.5.0.0
### ||| وفد مرة ,1.73.6.0.0,1.73.6.0.0,1.73.6.0.0
### ||| وفد ثعلبة ,1.73.7.0.0,1.73.7.0.0,1.73.7.0.0
### ||| وفد محارب ,1.73.8.0.0,1.73.8.0.0,1.73.8.0.0
### ||| وفد سعد بن بكر ,1.73.9.0.0,1.73.9.0.0,1.73.9.0.0
### ||| وفد كلاب ,1.73.10.0.0,1.73.10.0.0,1.73.10.0.0
### ||| وفد رؤاس بن كلاب ,1.73.11.0.0,1.73.11.0.0,1.73.11.0.0
### ||| وفد عقيل بن كعب ,1.73.12.0.0,1.73.12.0.0,1.73.12.0.0
### ||| وفد جعدة ,1.73.13.0.0,1.73.13.0.0,1.73.13.0.0
### ||| وفد قشير بن كعب ,1.73.14.0.0,1.73.14.0.0,1.73.14.0.0
### ||| وفد بني البكاء ,1.73.15.0.0,1.73.15.0.0,1.73.15.0.0
### ||| وفد كنانة ,1.73.16.0.0,1.73.16.0.0,1.73.16.0.0
### ||| وفد بني عبد بن عدي ,1.73.17.0.0,1.73.17.0.0,1.73.17.0.0
### ||| وفد أشجع ,1.73.18.0.0,1.73.18.0.0,1.73.18.0.0
### ||| وفد باهلة ,1.73.19.0.0,1.73.19.0.0,1.73.19.0.0
### ||| وفد سليم ,1.73.20.0.0,1.73.20.0.0,1.73.20.0.0
### ||| وفد هلال بن عامر ,1.73.21.0.0,1.73.21.0.0,1.73.21.0.0
### ||| وفد عامر بن صعصعة ,1.73.22.0.0,1.73.22.0.0,1.73.22.0.0
### ||| وفد ثقيف ,1.73.23.0.0,1.73.23.0.0,1.73.23.0.0
### ||| وفود ربيعة- عبد القيس ,1.73.24.0.0,1.73.24.0.0,1.73.24.0.0
### ||| وفد بكر بن وائل ,1.73.25.0.0,1.73.25.0.0,1.73.25.0.0
### ||| وفد تغلب ,1.73.26.0.0,1.73.26.0.0,1.73.26.0.0
### ||| وفد حنيفة ,1.73.27.0.0,1.73.27.0.0,1.73.27.0.0
### ||| وفد شيبان ,1.73.28.0.0,1.73.28.0.0,1.73.28.0.0
### ||| وفادات أهل اليمن وفد طيئ ,1.73.29.0.0,1.73.29.0.0,1.73.29.0.0
### ||| وفد تجيب ,1.73.30.0.0,1.73.30.0.0,1.73.30.0.0
### ||| وفد خولان ,1.73.31.0.0,1.73.31.0.0,1.73.31.0.0
### ||| وفد جعفي ,1.73.32.0.0,1.73.32.0.0,1.73.32.0.0
### ||| وفد صداء ,1.73.33.0.0,1.73.33.0.0,1.73.33.0.0
### ||| وفد مراد ,1.73.34.0.0,1.73.34.0.0,1.73.34.0.0
### ||| وفد زبيد ,1.73.35.0.0,1.73.35.0.0,1.73.35.0.0
### ||| وفد كندة ,1.73.36.0.0,1.73.36.0.0,1.73.36.0.0
### ||| وفد الصدف ,1.73.37.0.0,1.73.37.0.0,1.73.37.0.0
### ||| وفد خشين ,1.73.38.0.0,1.73.38.0.0,1.73.38.0.0
### ||| وفد سعد هذيم ,1.73.39.0.0,1.73.39.0.0,1.73.39.0.0
### ||| وفد بلي ,1.73.40.0.0,1.73.40.0.0,1.73.40.0.0
### ||| وفد بهراء ,1.73.41.0.0,1.73.41.0.0,1.73.41.0.0
### ||| وفد عذرة ,1.73.42.0.0,1.73.42.0.0,1.73.42.0.0
### ||| وفد سلامان ,1.73.43.0.0,1.73.43.0.0,1.73.43.0.0
### ||| وفد جهينة ,1.73.44.0.0,1.73.44.0.0,1.73.44.0.0
### ||| وفد كلب ,1.73.45.0.0,1.73.45.0.0,1.73.45.0.0
### ||| وفد جرم ,1.73.46.0.0,1.73.46.0.0,1.73.46.0.0
### ||| وفد الأزد ,1.73.47.0.0,1.73.47.0.0,1.73.47.0.0
### ||| وفد غسان ,1.73.48.0.0,1.73.48.0.0,1.73.48.0.0
### ||| وفد الحارث بن كعب ,1.73.49.0.0,1.73.49.0.0,1.73.49.0.0
### ||| وفد همدان ,1.73.50.0.0,1.73.50.0.0,1.73.50.0.0
### ||| وفد سعد العشيرة ,1.73.51.0.0,1.73.51.0.0,1.73.51.0.0
### ||| وفد عنس ,1.73.52.0.0,1.73.52.0.0,1.73.52.0.0
### ||| وفد الداريين ,1.73.53.0.0,1.73.53.0.0,1.73.53.0.0
### ||| وفد الرهاويين. حي من مذحج ,1.73.54.0.0,1.73.54.0.0,1.73.54.0.0
### ||| وفد غامد ,1.73.55.0.0,1.73.55.0.0,1.73.55.0.0
### ||| وفد النخع ,1.73.56.0.0,1.73.56.0.0,1.73.56.0.0
### ||| وفد بجيلة ,1.73.57.0.0,1.73.57.0.0,1.73.57.0.0
### ||| وفد خثعم ,1.73.58.0.0,1.73.58.0.0,1.73.58.0.0
### ||| وفد الأشعرين ,1.73.59.0.0,1.73.59.0.0,1.73.59.0.0
### ||| وفد حضرموت ,1.73.60.0.0,1.73.60.0.0,1.73.60.0.0
### ||| وفد أزد عمان ,1.73.61.0.0,1.73.61.0.0,1.73.61.0.0
### ||| وفد غافق ,1.73.62.0.0,1.73.62.0.0,1.73.62.0.0
### ||| وفد بارق ,1.73.63.0.0,1.73.63.0.0,1.73.63.0.0
### ||| وفد دوس ,1.73.64.0.0,1.73.64.0.0,1.73.64.0.0
### ||| وفد ثمالة والحدان ,1.73.65.0.0,1.73.65.0.0,1.73.65.0.0
### ||| وفد أسلم ,1.73.66.0.0,1.73.66.0.0,1.73.66.0.0
### ||| وفد جذام ,1.73.67.0.0,1.73.67.0.0,1.73.67.0.0
### ||| وفد مهرة ,1.73.68.0.0,1.73.68.0.0,1.73.68.0.0
### ||| وفد حمير ,1.73.69.0.0,1.73.69.0.0,1.73.69.0.0
### ||| وفد نجران ,1.73.70.0.0,1.73.70.0.0,1.73.70.0.0
### ||| وفد جيشان ,1.73.71.0.0,1.73.71.0.0,1.73.71.0.0
### ||| وفد السباع ,1.73.72.0.0,1.73.72.0.0,1.73.72.0.0
### || ذكر صفة رسول الله- صلى الله عليه وسلم - في التوراة والإنجيل ,1.74.0.0.0,1.74.0.0.0,1.74.0.0.0
### || ذكر صفة أخلاق رسول الله- صلى الله عليه وسلم - ,1.75.0.0.0,1.75.0.0.0,1.75.0.0.0
### ||| ذكر ما أعطى رسول الله - صلى الله عليه وسلم - من القوة على الجماع ,1.75.1.0.0,1.75.1.0.0,1.75.1.0.0
### ||| ذكر إعطائه القود من نفسه- صلى الله عليه وسلم - ,1.75.2.0.0,1.75.2.0.0,1.75.2.0.0
### ||| باب صفة كلامه- صلى الله عليه وسلم - ,1.75.3.0.0,1.75.3.0.0,1.75.3.0.0
### ||| باب صفة قراءته - صلى الله عليه وسلم - في صلاته وغيرها وحسن صوته- صلى الله عليه وسلم - ,1.75.4.0.0,1.75.4.0.0,1.75.4.0.0
### ||| ذكر صفته - صلى الله عليه وسلم - في خطبته ,1.75.5.0.0,1.75.5.0.0,1.75.5.0.0
### ||| ذكر حسن خلقه وعشرته- صلى الله عليه وسلم - ,1.75.6.0.0,1.75.6.0.0,1.75.6.0.0
### ||| ذكر صفته في مشيه- صلى الله عليه وسلم - ,1.75.7.0.0,1.75.7.0.0,1.75.7.0.0
### ||| ذكر صفته في مأكله- صلى الله عليه وسلم - أخبرنا يزيد بن هارون وإسحاق بن عيسى قالا: أخبرنا ,1.75.8.0.0,1.75.8.0.0,1.75.8.0.0
### ||| ذكر محاسن أخلاقه- صلى الله عليه وسلم - ,1.75.9.0.0,1.75.9.0.0,1.75.9.0.0
### ||| ذكر صلاة رسول الله- صلى الله عليه وسلم - ,1.75.10.0.0,1.75.10.0.0,1.75.10.0.0
### ||| ذكر قبول رسول الله - صلى الله عليه وسلم - الهدية وتركه الصدقة ,1.75.11.0.0,1.75.11.0.0,1.75.11.0.0
### ||| ذكر طعام رسول الله - صلى الله عليه وسلم - وما كان يعجبه منه ,1.75.12.0.0,1.75.12.0.0,1.75.12.0.0
### ||| ذكر ما كان يعاف رسول الله - صلى الله عليه وسلم - من الطعام والشراب ,1.75.13.0.0,1.75.13.0.0,1.75.13.0.0
### ||| ذكر ما حبب إلى رسول الله  - صلى الله عليه وسلم - من النساء والطيب ,1.75.14.0.0,1.75.14.0.0,1.75.14.0.0
### || ذكر شدة العيش على رسول الله- صلى الله عليه وسلم - ,1.76.0.0.0,1.76.0.0.0,1.76.0.0.0
### || ذكر صفة خلق رسول الله- صلى الله عليه وسلم - ,1.77.0.0.0,1.77.0.0.0,1.77.0.0.0
### ||| ذكر خاتم النبوة الذي كان بين كتفي رسول الله- صلى الله عليه  وسلم - ,1.77.1.0.0,1.77.1.0.0,1.77.1.0.0
### ||| ذكر شعر رسول الله- صلى الله عليه وسلم - ,1.77.2.0.0,1.77.2.0.0,1.77.2.0.0
### ||| ذكر شيب رسول الله- صلى الله عليه وسلم - ,1.77.3.0.0,1.77.3.0.0,1.77.3.0.0
### ||| ذكر من قال خضب رسول الله- صلى الله عليه وسلم - ,1.77.4.0.0,1.77.4.0.0,1.77.4.0.0
### || ذكر ما قال رسول الله - صلى الله عليه وسلم - وأصحابه في تغيير الشيب وكراهة الخضاب بالسواد ,1.78.0.0.0,1.78.0.0.0,1.78.0.0.0
### || ذكر من قال اطلى رسول الله - صلى الله عليه وسلم - بالنورة ,1.79.0.0.0,1.79.0.0.0,1.79.0.0.0
### || ذكر حجامة رسول الله- صلى الله عليه وسلم - ,1.80.0.0.0,1.80.0.0.0,1.80.0.0.0
### || ذكر أخذ رسول الله - صلى الله عليه وسلم - من شاربه ,1.81.0.0.0,1.81.0.0.0,1.81.0.0.0
### || ذكر لباس رسول الله - صلى الله عليه وسلم - وما روي في البياض ,1.82.0.0.0,1.82.0.0.0,1.82.0.0.0
### || السندس والحرير الذي لبسه رسول الله - صلى الله عليه وسلم - ثم تركه ,1.83.0.0.0,1.83.0.0.0,1.83.0.0.0
### || ذكر أصناف لباسه - صلى الله عليه وسلم - أيضا وطولها وعرضها ,1.84.0.0.0,1.84.0.0.0,1.84.0.0.0
### || صفة أزرته- صلى الله عليه وسلم - ,1.85.0.0.0,1.85.0.0.0,1.85.0.0.0
### || ذكر قناعته - صلى الله عليه وسلم - بثوبه ولباسه القميص وما كان يقول إذا لبس ثوبا عليه ,1.86.0.0.0,1.86.0.0.0,1.86.0.0.0
### || ذكر صلاة رسول الله - صلى الله عليه وسلم - في ثوب واحد ولبسه إياه ,1.87.0.0.0,1.87.0.0.0,1.87.0.0.0
### || ذكر ضجاع رسول الله - صلى الله عليه وسلم - وافتراشه ,1.88.0.0.0,1.88.0.0.0,1.88.0.0.0
### || ذكر الخمرة التي كان يصلي عليها رسول الله - صلى الله عليه وسلم - ,1.89.0.0.0,1.89.0.0.0,1.89.0.0.0
### || ذكر خاتم رسول الله - صلى الله عليه وسلم - الذهب ,1.90.0.0.0,1.90.0.0.0,1.90.0.0.0
### || ذكر خاتم رسول الله - صلى الله عليه وسلم - الفضة ,1.91.0.0.0,1.91.0.0.0,1.91.0.0.0
### || ذكر خاتم رسول الله - صلى الله عليه وسلم - الملوي عليه فضة ,1.92.0.0.0,1.92.0.0.0,1.92.0.0.0
### || ذكر نقش خاتم رسول الله. ص ,1.93.0.0.0,1.93.0.0.0,1.93.0.0.0
### || ذكر ما صار إليه أمر خاتمه- صلى الله عليه وسلم - ,1.94.0.0.0,1.94.0.0.0,1.94.0.0.0
### || ذكر نعل رسول الله - صلى الله عليه وسلم - ,1.95.0.0.0,1.95.0.0.0,1.95.0.0.0
### || ذكر خف رسول الله- صلى الله عليه وسلم - ,1.96.0.0.0,1.96.0.0.0,1.96.0.0.0
### || ذكر سواك رسول الله- صلى الله عليه وسلم - ,1.97.0.0.0,1.97.0.0.0,1.97.0.0.0
### || ذكر مشط رسول الله - صلى الله عليه وسلم - ومكحلته ومرآته وقدحه ,1.98.0.0.0,1.98.0.0.0,1.98.0.0.0
### || ذكر سيوف رسول الله- صلى الله عليه وسلم - ,1.99.0.0.0,1.99.0.0.0,1.99.0.0.0
### || ذكر درع رسول الله- صلى الله عليه وسلم - ,1.100.0.0.0,1.100.0.0.0,1.100.0.0.0
### || ذكر ترس رسول الله- صلى الله عليه وسلم - ,1.101.0.0.0,1.101.0.0.0,1.101.0.0.0
### || ذكر أرماح رسول الله - صلى الله عليه وسلم - وقسيه ,1.102.0.0.0,1.102.0.0.0,1.102.0.0.0
### || ذكر خيل رسول الله - صلى الله عليه وسلم - ودوابه ,1.103.0.0.0,1.103.0.0.0,1.103.0.0.0
### || ذكر إبل رسول الله- صلى الله عليه وسلم - ,1.104.0.0.0,1.104.0.0.0,1.104.0.0.0
### || ذكر لقاح رسول الله - صلى الله عليه وسلم - ,1.105.0.0.0,1.105.0.0.0,1.105.0.0.0
### || ذكر منايح رسول الله - صلى الله عليه وسلم - من الغنم ,1.106.0.0.0,1.106.0.0.0,1.106.0.0.0
### || ذكر خدم رسول الله - صلى الله عليه وسلم - ومواليه ,1.107.0.0.0,1.107.0.0.0,1.107.0.0.0
### || ذكر بيوت رسول الله - صلى الله عليه وسلم - وحجر أزواجه ,1.108.0.0.0,1.108.0.0.0,1.108.0.0.0
### || ذكر صدقات رسول الله- صلى الله عليه وسلم - ,1.109.0.0.0,1.109.0.0.0,1.109.0.0.0
### || ذكر البئار التي شرب منها رسول الله- صلى الله عليه وسلم - ,1.110.0.0.0,1.110.0.0.0,1.110.0.0.0
### | [الجزء الثاني] - تتمة السيرة النبوية الشريفة ,2.0.0.0.0,2.0.0.0.0,2.0.0.0.0
### || ذكر عدد مغازي رسول الله - صلى الله عليه وسلم - وسراياه وأسمائها وتواريخها وجمل ما كان في كل غزاة وسرية منها ,2.1.0.0.0,2.1.0.0.0,2.1.0.0.0
### ||| سرية عبيدة بن الحارث ,2.1.1.0.0,2.1.1.0.0,2.1.1.0.0
### ||| سرية سعد بن أبي وقاص ,2.1.2.0.0,2.1.2.0.0,2.1.2.0.0
### ||| غزوة الأبواء ,2.1.3.0.0,2.1.3.0.0,2.1.3.0.0
### ||| غزوة بواط ,2.1.4.0.0,2.1.4.0.0,2.1.4.0.0
### ||| غزوة طلب كرز بن جابر الفهري ,2.1.5.0.0,2.1.5.0.0,2.1.5.0.0
### ||| غزوة ذي العشيرة ,2.1.6.0.0,2.1.6.0.0,2.1.6.0.0
### ||| سرية عبد الله بن جحش الأسدي ,2.1.7.0.0,2.1.7.0.0,2.1.7.0.0
### ||| غزوة بدر ,2.1.8.0.0,2.1.8.0.0,2.1.8.0.0
### ||| سرية عمير بن عدي ,2.1.9.0.0,2.1.9.0.0,2.1.9.0.0
### ||| سرية سالم بن عمير ,2.1.10.0.0,2.1.10.0.0,2.1.10.0.0
### ||| غزوة بني قينقاع ,2.1.11.0.0,2.1.11.0.0,2.1.11.0.0
### ||| غزوة السويق ,2.1.12.0.0,2.1.12.0.0,2.1.12.0.0
### ||| غزوة قرقرة الكدر ,2.1.13.0.0,2.1.13.0.0,2.1.13.0.0
### ||| سرية قتل كعب بن الأشرف ,2.1.14.0.0,2.1.14.0.0,2.1.14.0.0
### ||| غزوة رسول الله - صلى الله عليه وسلم - غطفان ,2.1.15.0.0,2.1.15.0.0,2.1.15.0.0
### ||| غزوة رسول الله - صلى الله عليه وسلم - بني سليم ,2.1.16.0.0,2.1.16.0.0,2.1.16.0.0
### ||| سرية زيد بن حارثة ,2.1.17.0.0,2.1.17.0.0,2.1.17.0.0
### ||| غزوة رسول الله - صلى الله عليه وسلم - أحدا ,2.1.18.0.0,2.1.18.0.0,2.1.18.0.0
### |||| من قتل من المسلمين يوم أحد ,2.1.18.1.0,2.1.18.1.0,2.1.18.1.0
### ||| غزوة رسول الله - صلى الله عليه وسلم - حمراء الأسد ,2.1.19.0.0,2.1.19.0.0,2.1.19.1.0
### ||| سرية أبي سلمة بن عبد الأسد المخزومي ,2.1.20.0.0,2.1.20.0.0,2.1.20.1.0
### ||| سرية عبد الله بن أنيس ,2.1.21.0.0,2.1.21.0.0,2.1.21.1.0
### ||| سرية المنذر بن عمرو ,2.1.22.0.0,2.1.22.0.0,2.1.22.1.0
### ||| سرية مرثد بن أبي مرثد ,2.1.23.0.0,2.1.23.0.0,2.1.23.1.0
### ||| غزوة رسول الله - صلى الله عليه وسلم - بني النضير ,2.1.24.0.0,2.1.24.0.0,2.1.24.1.0
### ||| غزوة رسول الله - صلى الله عليه وسلم - بدر الموعد ,2.1.25.0.0,2.1.25.0.0,2.1.25.1.0
### ||| غزوة رسول الله - صلى الله عليه وسلم - ذات الرقاع ,2.1.26.0.0,2.1.26.0.0,2.1.26.1.0
### ||| غزوة رسول الله - صلى الله عليه وسلم - دومة الجندل ,2.1.27.0.0,2.1.27.0.0,2.1.27.1.0
### ||| غزوة رسول الله - صلى الله عليه وسلم - المريسيع ,2.1.28.0.0,2.1.28.0.0,2.1.28.1.0
### ||| غزوة رسول الله - صلى الله عليه وسلم - الخندق وهي غزوة الأحزاب» ,2.1.29.0.0,2.1.29.0.0,2.1.29.1.0
### ||| غزوة رسول الله - صلى الله عليه وسلم - إلى بني قريظة ,2.1.30.0.0,2.1.30.0.0,2.1.30.1.0
### ||| سرية محمد بن مسلمة  إلى القرطاء ,2.1.31.0.0,2.1.31.0.0,2.1.31.1.0
### ||| غزوة رسول الله - صلى الله عليه وسلم - بني لحيان ,2.1.32.0.0,2.1.32.0.0,2.1.32.1.0
### ||| غزوة رسول الله - صلى الله عليه وسلم - الغابة ,2.1.33.0.0,2.1.33.0.0,2.1.33.1.0
### ||| سرية عكاشة بن محصن الأسدي إلى الغمر ,2.1.34.0.0,2.1.34.0.0,2.1.34.1.0
### ||| سرية محمد بن مسلمة إلى ذي القصة ,2.1.35.0.0,2.1.35.0.0,2.1.35.1.0
### ||| سرية أبي عبيدة بن الجراح إلى ذي القصة ,2.1.36.0.0,2.1.36.0.0,2.1.36.1.0
