Column1,Column2,Column3,Column4
### ||| سرية زيد بن حارثة إلى بني سليم بالجموم ,2.1.37.0.0,2.1.37.0.0,2.1.37.1.0
### ||| سرية زيد بن حارثة إلى العيص ,2.1.38.0.0,2.1.38.0.0,2.1.38.1.0
### ||| سرية زيد بن حارثة إلى الطرف ,2.1.39.0.0,2.1.39.0.0,2.1.39.1.0
### ||| سرية زيد بن حارثة إلى حسمى ,2.1.40.0.0,2.1.40.0.0,2.1.40.1.0
### ||| سرية زيد بن حارثة إلى وادي القرى ,2.1.41.0.0,2.1.41.0.0,2.1.41.1.0
### ||| سرية عبد الرحمن بن عوف إلى دومة الجندل ,2.1.42.0.0,2.1.42.0.0,2.1.42.1.0
### ||| سرية علي بن أبي طالب إلى بني سعد بن بكر بفدك ,2.1.43.0.0,2.1.43.0.0,2.1.43.1.0
### ||| سرية زيد بن حارثة إلى أم قرفة بوادي القرى ,2.1.44.0.0,2.1.44.0.0,2.1.44.1.0
### ||| سرية عبد الله بن عتيك إلى أبي رافع ,2.1.45.0.0,2.1.45.0.0,2.1.45.1.0
### ||| سرية عبد الله بن رواحة إلى أسير بن زارم ,2.1.46.0.0,2.1.46.0.0,2.1.46.1.0
### ||| سرية كرز بن جابر الفهري إلى العرنيين ,2.1.47.0.0,2.1.47.0.0,2.1.47.1.0
### ||| سرية عمرو بن أمية الضمري ,2.1.48.0.0,2.1.48.0.0,2.1.48.1.0
### ||| غزوة رسول الله - صلى الله عليه وسلم - الحديبية ,2.1.49.0.0,2.1.49.0.0,2.1.49.1.0
### ||| غزوة رسول الله - صلى الله عليه وسلم - خيبر ,2.1.50.0.0,2.1.50.0.0,2.1.50.1.0
### ||| سرية عمر بن الخطاب. رحمه الله. إلى تربة ,2.1.51.0.0,2.1.51.0.0,2.1.51.1.0
### ||| سرية أبي بكر الصديق. رضي الله عنه. إلى بني كلاب بنجد ,2.1.52.0.0,2.1.52.0.0,2.1.52.1.0
### ||| سرية بشير بن سعد الأنصاري إلى فدك ,2.1.53.0.0,2.1.53.0.0,2.1.53.1.0
### ||| سرية غالب بن عبد الله الليثي إلى الميفعة ,2.1.54.0.0,2.1.54.0.0,2.1.54.1.0
### ||| سرية بشير بن سعد الأنصاري إلى يمن وجبار ,2.1.55.0.0,2.1.55.0.0,2.1.55.1.0
### ||| عمرة رسول الله - صلى الله عليه وسلم - القضية ,2.1.56.0.0,2.1.56.0.0,2.1.56.1.0
### ||| سرية ابن أبي العوجاء السلمي إلى بني سليم ,2.1.57.0.0,2.1.57.0.0,2.1.57.1.0
### ||| سرية غالب بن عبد الله الليثي إلى بني الملوح بالكديد ,2.1.58.0.0,2.1.58.0.0,2.1.58.1.0
### ||| سرية غالب بن عبد الله الليثي أيضا إلى مصاب أصحاب بشير بن سعد بفدك ,2.1.59.0.0,2.1.59.0.0,2.1.59.1.0
### ||| سرية شجاع بن وهب الأسدي إلى بني عامر بالسي ,2.1.60.0.0,2.1.60.0.0,2.1.60.1.0
### ||| سرية كعب بن عمير الغفاري إلى ذات أطلاح ,2.1.61.0.0,2.1.61.0.0,2.1.61.1.0
### ||| سرية مؤتة ,2.1.62.0.0,2.1.62.0.0,2.1.62.1.0
### ||| سرية عمرو بن العاص إلى ذات السلاسل ,2.1.63.0.0,2.1.63.0.0,2.1.63.1.0
### ||| سرية الخبط أميرها أبو عبيدة بن الجراح ,2.1.64.0.0,2.1.64.0.0,2.1.64.1.0
### ||| سرية أبي قتادة بن ربعي الأنصاري إلى خضرة» ,2.1.65.0.0,2.1.65.0.0,2.1.65.1.0
### ||| سرية أبي قتادة بن ربعي الأنصاري إلى بطن إضم ,2.1.66.0.0,2.1.66.0.0,2.1.66.1.0
### ||| غزوة رسول الله - صلى الله عليه وسلم - عام الفتح ,2.1.67.0.0,2.1.67.0.0,2.1.67.1.0
### ||| سرية خالد بن الوليد إلى العزى ,2.1.68.0.0,2.1.68.0.0,2.1.68.1.0
### ||| سرية عمرو بن العاص إلى سواع ,2.1.69.0.0,2.1.69.0.0,2.1.69.1.0
### ||| سرية سعد بن زيد الأشهلي إلى مناة ,2.1.70.0.0,2.1.70.0.0,2.1.70.1.0
### ||| سرية خالد بن الوليد إلى بني جذيمة من كنانة ,2.1.71.0.0,2.1.71.0.0,2.1.71.1.0
### ||| غزوة رسول الله - صلى الله عليه وسلم - إلى حنين ,2.1.72.0.0,2.1.72.0.0,2.1.72.1.0
### ||| سرية الطفيل بن عمرو الدوسي إلى ذي الكفين ,2.1.73.0.0,2.1.73.0.0,2.1.73.1.0
### ||| غزوة رسول الله - صلى الله عليه وسلم - الطائف ,2.1.74.0.0,2.1.74.0.0,2.1.74.1.0
### ||| سرية عيينة بن حصن الفزاري إلى بني تميم ,2.1.75.0.0,2.1.75.0.0,2.1.75.1.0
### ||| سرية قطبة بن عامر بن حديدة إلى خثعم ,2.1.76.0.0,2.1.76.0.0,2.1.76.1.0
### ||| سرية الضحاك بن سفيان الكلابي إلى بني كلاب ,2.1.77.0.0,2.1.77.0.0,2.1.77.1.0
### ||| سرية علقمة بن مجزز المدلجي إلى الحبشة ,2.1.78.0.0,2.1.78.0.0,2.1.78.1.0
### ||| سرية علي بن أبي طالب إلى الفلس صنم طيئ ليهدمه ,2.1.79.0.0,2.1.79.0.0,2.1.79.1.0
### ||| سرية عكاشة بن محصن الأسدي إلى الجناب أرض عذرة وبلي ,2.1.80.0.0,2.1.80.0.0,2.1.80.1.0
### ||| غزوة رسول الله - صلى الله عليه وسلم - تبوك ,2.1.81.0.0,2.1.81.0.0,2.1.81.1.0
### ||| حجة أبي بكر الصديق بالناس ,2.1.82.0.0,2.1.82.0.0,2.1.82.1.0
### ||| سرية خالد بن الوليد إلى بني عبد المدان بنجران ,2.1.83.0.0,2.1.83.0.0,2.1.83.1.0
### ||| سرية علي بن أبي طالب. رحمه الله. إلى اليمن. يقال مرتين ,2.1.84.0.0,2.1.84.0.0,2.1.84.1.0
### ||| ذكر عمرة النبي- صلى الله عليه وسلم - ,2.1.85.0.0,2.1.85.0.0,2.1.85.1.0
### ||| حجة الوداع ,2.1.86.0.0,2.1.86.0.0,2.1.86.1.0
### ||| سرية أسامة بن زيد بن حارثة ,2.1.87.0.0,2.1.87.0.0,2.1.87.1.0
### || ذكر ما قرب لرسول الله - صلى الله عليه وسلم - من أجله ,2.2.0.0.0,2.2.0.0.0,2.2.0.0.0
### || ذكر عرض رسول الله - صلى الله عليه وسلم - القرآن على جبريل واعتكافه في السنة التي  قبض فيها ,2.3.0.0.0,2.3.0.0.0,2.3.0.0.0
### || ذكر من قال: إن اليهود سحرت رسول الله- صلى الله عليه وسلم - ,2.4.0.0.0,2.4.0.0.0,2.4.0.0.0
### || ذكر ما سم به رسول الله- صلى الله عليه وسلم - ,2.5.0.0.0,2.5.0.0.0,2.5.0.0.0
### || ذكر خروج رسول الله - صلى الله عليه وسلم - إلى البقيع واستغفاره لأهله والشهداء ,2.6.0.0.0,2.6.0.0.0,2.6.0.0.0
### || ذكر أول ما بدأ برسول الله - صلى الله عليه وسلم - وجعه الذي توفى فيه ,2.7.0.0.0,2.7.0.0.0,2.7.0.0.0
### || ذكر شدة المرض على رسول الله- صلى الله عليه وسلم - ,2.8.0.0.0,2.8.0.0.0,2.8.0.0.0
### || ذكر ما كان رسول الله - صلى الله عليه وسلم - يعوذ به ويعوذه جبريل ,2.9.0.0.0,2.9.0.0.0,2.9.0.0.0
### || ذكر صلاة رسول الله - صلى الله عليه وسلم - بأصحابه في مرضه ,2.10.0.0.0,2.10.0.0.0,2.10.0.0.0
### || ذكر أمر رسول الله - صلى الله عليه وسلم - أبا بكر أن يصلي بالناس في مرضه ,2.11.0.0.0,2.11.0.0.0,2.11.0.0.0
### || ذكر ما قال رسول الله - صلى الله عليه وسلم - في مرضه لأبي بكر. رضي الله عنه ,2.12.0.0.0,2.12.0.0.0,2.12.0.0.0
### || ذكر سد الأبواب غير باب أبي بكر. رضي الله عنه ,2.13.0.0.0,2.13.0.0.0,2.13.0.0.0
### || ذكر تخيير رسول الله- صلى الله عليه وسلم - ,2.14.0.0.0,2.14.0.0.0,2.14.0.0.0
### || ذكر قسم رسول الله - صلى الله عليه وسلم - بين نسائه في مرضه من نفسه ,2.15.0.0.0,2.15.0.0.0,2.15.0.0.0
### || ذكر استئذان رسول الله - صلى الله عليه وسلم - نساءه أن يمرض في بيت عائشة ,2.16.0.0.0,2.16.0.0.0,2.16.0.0.0
### || ذكر السواك الذي استن به رسول الله - صلى الله عليه وسلم - في مرضه الذي مات فيه ,2.17.0.0.0,2.17.0.0.0,2.17.0.0.0
### || ذكر اللدود الذي لد به رسول الله - صلى الله عليه وسلم - في مرضه ,2.18.0.0.0,2.18.0.0.0,2.18.0.0.0
### || ذكر الدنانير التي قسمها رسول الله - صلى الله عليه وسلم - في مرضه الذي مات فيه ,2.19.0.0.0,2.19.0.0.0,2.19.0.0.0
### || ذكر الكنيسة التي ذكرها أزواج رسول الله - صلى الله عليه وسلم - في مرضه وما قال في ذلك رسول الله- صلى الله عليه وسلم - ,2.20.0.0.0,2.20.0.0.0,2.20.0.0.0
### || ذكر الكتاب الذي أراد رسول الله - صلى الله عليه وسلم - أن يكتبه لأمته في مرضه الذي مات فيه ,2.21.0.0.0,2.21.0.0.0,2.21.0.0.0
### || ذكر ما قال العباس بن عبد المطلب لعلي بن أبي طالب في مرض رسول الله- صلى الله عليه وسلم - ,2.22.0.0.0,2.22.0.0.0,2.22.0.0.0
### || ذكر ما قال رسول الله - صلى الله عليه وسلم - لفاطمة ابنته في مرضه.صلوات الله عليهما وسلامه ,2.23.0.0.0,2.23.0.0.0,2.23.0.0.0
### || ذكر ما قال رسول الله - صلى الله عليه وسلم - في مرضه لأسامة بن زيد.رحمه الله ,2.24.0.0.0,2.24.0.0.0,2.24.0.0.0
### || ذكر ما قال رسول الله - صلى الله عليه وسلم - في مرضه الذي مات فيه للأنصار. رحمهم الله ,2.25.0.0.0,2.25.0.0.0,2.25.0.0.0
### || ذكر ما أوصى به رسول الله - صلى الله عليه وسلم - في مرضه الذي مات فيه ,2.26.0.0.0,2.26.0.0.0,2.26.0.0.0
### || ذكر نزول الموت برسول الله- صلى الله عليه وسلم - ,2.27.0.0.0,2.27.0.0.0,2.27.0.0.0
### || ذكر وفاة رسول الله- صلى الله عليه وسلم - ,2.28.0.0.0,2.28.0.0.0,2.28.0.0.0
### || ذكر من قال إن رسول الله - صلى الله عليه وسلم - لم يوص وإنه توفي ورأسه في حجر عائشة ,2.29.0.0.0,2.29.0.0.0,2.29.0.0.0
### || ذكر من قال توفي رسول الله - صلى الله عليه وسلم - في حجر علي بن أبي طالب ,2.30.0.0.0,2.30.0.0.0,2.30.0.0.0
### || ذكر تسجية رسول الله - صلى الله عليه وسلم - حين توفي بثوب حبرة ,2.31.0.0.0,2.31.0.0.0,2.31.0.0.0
### || ذكر تقبيل أبي بكر الصديق رسول الله - صلى الله عليه وسلم - بعد وفاته ,2.32.0.0.0,2.32.0.0.0,2.32.0.0.0
### || ذكر كلام الناس حين شكوا في وفاة رسول الله- صلى الله عليه وسلم - ,2.33.0.0.0,2.33.0.0.0,2.33.0.0.0
### || ذكر كم مرض رسول الله - صلى الله عليه وسلم - واليوم الذي توفي فيه ,2.34.0.0.0,2.34.0.0.0,2.34.0.0.0
### || ذكر التعزية برسول الله- صلى الله عليه وسلم - ,2.35.0.0.0,2.35.0.0.0,2.35.0.0.0
### || ذكر القميص الذي غسل فيه رسول الله- صلى الله عليه وسلم - ,2.36.0.0.0,2.36.0.0.0,2.36.0.0.0
### || ذكر غسل رسول الله - صلى الله عليه وسلم - وتسمية من غسله ,2.37.0.0.0,2.37.0.0.0,2.37.0.0.0
### || ذكر من قال كفن رسول الله - صلى الله عليه وسلم - في ثلاثة أثواب ,2.38.0.0.0,2.38.0.0.0,2.38.0.0.0
### || ذكر من قال كفن رسول الله - صلى الله عليه وسلم - في ثلاثة أثواب أحدها حبرة ,2.39.0.0.0,2.39.0.0.0,2.39.0.0.0
### || ذكر من قال كفن رسول الله - صلى الله عليه وسلم - في ثلاثة أثواب برود. ومن قال كفن في قميص وحلة ,2.40.0.0.0,2.40.0.0.0,2.40.0.0.0
### || ذكر حنوط النبي- صلى الله عليه وسلم - ,2.41.0.0.0,2.41.0.0.0,2.41.0.0.0
### || ذكر الصلاة على رسول الله- صلى الله عليه وسلم - ,2.42.0.0.0,2.42.0.0.0,2.42.0.0.0
### || ذكر موضع قبر رسول الله- صلى الله عليه وسلم - ,2.43.0.0.0,2.43.0.0.0,2.43.0.0.0
### || ذكر حفر قبر رسول الله - صلى الله عليه وسلم - واللحد له ,2.44.0.0.0,2.44.0.0.0,2.44.0.0.0
### || ذكر ما ألقي في قبر النبي- صلى الله عليه وسلم - ,2.45.0.0.0,2.45.0.0.0,2.45.0.0.0
### || ذكر من نزل في قبر النبي- صلى الله عليه وسلم - ,2.46.0.0.0,2.46.0.0.0,2.46.0.0.0
### || ذكر قول المغيرة بن شعبة إنه آخر الناس عهدا برسول الله- صلى الله عليه وسلم - ,2.47.0.0.0,2.47.0.0.0,2.47.0.0.0
### || ذكر دفن رسول الله- صلى الله عليه وسلم - ,2.48.0.0.0,2.48.0.0.0,2.48.0.0.0
### || ذكر رش الماء على قبر رسول الله- صلى الله عليه وسلم - ,2.49.0.0.0,2.49.0.0.0,2.49.0.0.0
### || ذكر تسنيم قبر رسول الله- صلى الله عليه وسلم - ,2.50.0.0.0,2.50.0.0.0,2.50.0.0.0
### || ذكر سن رسول الله - صلى الله عليه وسلم - يوم قبض ,2.51.0.0.0,2.51.0.0.0,2.51.0.0.0
### || ذكر مقام رسول الله - صلى الله عليه وسلم - بالمدينة بعد الهجرة إلى أن قبض ,2.52.0.0.0,2.52.0.0.0,2.52.0.0.0
### || ذكر الحزن على رسول الله - صلى الله عليه وسلم - ومن ندبه وبكى عليه ,2.53.0.0.0,2.53.0.0.0,2.53.0.0.0
### || ذكر ميراث رسول الله - صلى الله عليه وسلم - وما ترك ,2.54.0.0.0,2.54.0.0.0,2.54.0.0.0
### || ذكر من قضى دين رسول الله - صلى الله عليه وسلم - وعداته ,2.55.0.0.0,2.55.0.0.0,2.55.0.0.0
### || ذكر من رثى النبي- صلى الله عليه وسلم - ,2.56.0.0.0,2.56.0.0.0,2.56.0.0.0
### | ذكر من كان يفتي بالمدينة ويقتدى به من أصحاب رسول الله - صلى الله عليه وسلم - على عهد رسول الله - صلى الله عليه وسلم - وبعد ذلك وإلى من انتهى علمهم ,3.0.0.0.0,3.0.0.0.0,3.0.0.0.0
### ||| علي بن أبي طالب. رضي الله عنه ,3.0.1.0.0,3.0.1.0.0,3.0.1.0.0
### ||| عبد الرحمن بن عوف. رضي الله عنه ,3.0.2.0.0,3.0.2.0.0,3.0.2.0.0
### ||| أبي بن كعب. رحمه الله ,3.0.3.0.0,3.0.3.0.0,3.0.3.0.0
### ||| عبد الله بن مسعود ,3.0.4.0.0,3.0.4.0.0,3.0.4.0.0
### ||| أبو موسى الأشعري ,3.0.5.0.0,3.0.5.0.0,3.0.5.0.0
### ||| مشايخ شتى ,3.0.6.0.0,3.0.6.0.0,3.0.6.0.0
### ||| معاذ بن جبل. رحمه الله ,3.0.7.0.0,3.0.7.0.0,3.0.7.0.0
### || باب أهل العلم والفتوى من أصحاب رسول الله- صلى الله عليه وسلم - ,3.1.0.0.0,3.1.0.0.0,3.1.0.0.0
### ||| عبد الله بن سلام ,3.1.1.0.0,3.1.1.0.0,3.1.1.0.0
### ||| أبو ذر ,3.1.2.0.0,3.1.2.0.0,3.1.2.0.0
### || ذكر من جمع القرآن على عهد رسول الله- صلى الله عليه وسلم - ,3.2.0.0.0,3.2.0.0.0,3.2.0.0.0
### ||| زيد بن ثابت ,3.2.1.0.0,3.2.1.0.0,3.2.1.0.0
### ||| أبو هريرة ,3.2.2.0.0,3.2.2.0.0,3.2.2.0.0
### ||| ابن عباس ,3.2.3.0.0,3.2.3.0.0,3.2.3.0.0
### ||| عبد الله بن عمر ,3.2.4.0.0,3.2.4.0.0,3.2.4.0.0
### ||| عبد الله بن عمرو ,3.2.5.0.0,3.2.5.0.0,3.2.5.0.0
### ||| باب ,3.2.6.0.0,3.2.6.0.0,3.2.6.0.0
### || عائشة زوج النبي- صلى الله عليه وسلم - ,3.3.0.0.0,3.3.0.0.0,3.3.0.0.0
### || ذكر من كان يفتي بالمدينة بعد أصحاب رسول الله - صلى الله عليه وسلم - من أبناء المهاجرين وأبناء الأنصار وغيرهم ,3.4.0.0.0,3.4.0.0.0,3.4.0.0.0
### ||| سعيد بن المسيب ,3.4.1.0.0,3.4.1.0.0,3.4.1.0.0
### ||| سليمان بن يسار ,3.4.2.0.0,3.4.2.0.0,3.4.2.0.0
### ||| أبو بكر بن عبد الرحمن ,3.4.3.0.0,3.4.3.0.0,3.4.3.0.0
### ||| عكرمة ,3.4.4.0.0,3.4.4.0.0,3.4.4.0.0
### ||| عطاء بن أبي رباح ,3.4.5.0.0,3.4.5.0.0,3.4.5.0.0
### ||| عمرة بنت عبد الرحمن وعروة بن الزبير ,3.4.6.0.0,3.4.6.0.0,3.4.6.0.0
### ||| ابن شهاب الزهري ,3.4.7.0.0,3.4.7.0.0,3.4.7.0.0
### | [الجزء الثالث] - القول في الطبقة الأولى وهم البدريين من المهاجرين والأنصار ,5.0.0.0.0,4.0.0.0.0,5.0.0.0.0
### || طبقات البدريين من المهاجرين (ذكر الطبقة الأولى) ,5.0.1.0.0,4.1.0.0.0,5.0.1.0.0
### ||| ومن بني المطلب بن عبد مناف بن قصي ,5.0.1.1.0,4.1.1.0.0,5.0.1.1.0
### ||| ومن  بني عبد شمس بن عبد مناف بن قصي ,5.0.1.2.0,4.1.2.0.0,5.0.1.2.0
### ||| ومن حلفاء بني عبد شمس من بني غنم بن دودان ابن أسد بن خزيمة بن مدركة ,5.0.1.3.0,4.1.3.0.0,5.0.1.3.0
### ||| ومن حلفاء بني عبد شمس من بني سليم بن منصور ,5.0.1.4.0,4.1.4.0.0,5.0.1.4.0
### ||| ومن حلفاء بني نوفل بن عبد مناف بن قصي ,5.0.1.5.0,4.1.5.0.0,5.0.1.5.0
### ||| ومن بني أسد بن عبد العزى بن قصي ,5.0.1.6.0,4.1.6.0.0,5.0.1.6.0
### ||| ومن حلفاء بني أسد بن عبد العزى بن قصي وهم حلفاء الزبير بن العوام ,5.0.1.7.0,4.1.7.0.0,5.0.1.7.0
### ||| ومن بني عبد الدار بن قصي ,5.0.1.8.0,4.1.8.0.0,5.0.1.8.0
### ||| ومن بني عبد بن قصي بن كلاب ,5.0.1.9.0,4.1.9.0.0,5.0.1.9.0
### ||| ومن بني زهرة بن كلاب بن مرة ,5.0.1.10.0,4.1.10.0.0,5.0.1.10.0
### ||| ومن حلفاء بني زهرة بن كلاب من قبائل العرب ,5.0.1.11.0,4.1.11.0.0,5.0.1.11.0
### ||| ومن بني تيم بن مرة بن كعب ,5.0.1.12.0,4.1.12.0.0,5.0.1.12.0
### ||| ومن بني مخزوم بن يقظة بن مرة بن كعب بن لؤي بن غالب ,5.0.1.13.0,4.1.13.0.0,5.0.1.13.0
### ||| ومن حلفاء بني مخزوم ,5.0.1.14.0,4.1.14.0.0,5.0.1.14.0
### ||| ومن بني عدي بن كعب بن لؤي ,5.0.1.15.0,4.1.15.0.0,5.0.1.15.0
### ||| ومن حلفاء بني عدي بن كعب ومواليهم ,5.0.1.16.0,4.1.16.0.0,5.0.1.16.0
### ||| ومن بني سهم بن عمرو بن هصيص بن كعب بن لؤي ,5.0.1.17.0,4.1.17.0.0,5.0.1.17.0
### ||| ومن بني جمح بن عمرو بن هصيص بن كعب بن لؤي ,5.0.1.18.0,4.1.18.0.0,5.0.1.18.0
### ||| ومن بني عامر بن لؤي ,5.0.1.19.0,4.1.19.0.0,5.0.1.19.0
### ||| ومن حلفاء بني عامر بن لؤي من أهل اليمن ,5.0.1.20.0,4.1.20.0.0,5.0.1.20.0
### ||| ومن بني فهر بن مالك بن النضر بن كنانة. وهم  آخر بطون قريش ,5.0.1.21.0,4.1.21.0.0,5.0.1.21.0
### || طبقات البدريين من الأنصار ,5.1.0.0.0,4.2.0.0.0,5.1.0.0.0
### ||| (الطبقة الأولى من الأنصار) ,5.1.1.0.0,4.2.1.0.0,5.1.1.0.0
### |||| من بني عبد الأشهل ,5.1.1.1.0,4.2.1.1.0,5.1.1.1.0
### |||| ومن حلفاء بني عبد الأشهل بن جشم ,5.1.1.2.0,4.2.1.2.0,5.1.1.2.0
### |||| ومن بني حارثة بن الحارث بن الخزرج بن عمرو. وهو النبيت. ابن مالك بن الأوس ,5.1.1.3.0,4.2.1.3.0,5.1.1.3.0
### |||| ومن حلفاء بني حارثة ,5.1.1.4.0,4.2.1.4.0,5.1.1.4.0
### |||| ومن بني ظفر واسمه كعب بن الخزرج بن عمرو. وهو النبيت. ابن مالك بن الأوس ,5.1.1.5.0,4.2.1.5.0,5.1.1.5.0
### |||| ومن حلفاء بني ظفر ,5.1.1.6.0,4.2.1.6.0,5.1.1.6.0
### |||| ومن بني عمرو بن عوف بن مالك بن الأوس ثم من بني أمية بن زيد بن مالك بن عوف بن عمرو بن عوف ,5.1.1.7.0,4.2.1.7.0,5.1.1.7.0
### |||| ومن بني ضبيعة بن زيد بن مالك بن عوف بن عمرو بن عوف ,5.1.1.8.0,4.2.1.8.0,5.1.1.8.0
### |||| ومن بني عبيد بن زيد بن مالك بن عوف بن عمرو بن عوف ,5.1.1.9.0,4.2.1.9.0,5.1.1.9.0
### |||| ومن بني العجلان بن حارثة من بلي قضاعة وهم حلفاء بني زيد بن مالك بن عوف كلهم. ,5.1.1.10.0,4.2.1.10.0,5.1.1.10.0
### |||| ومن بني معاوية بن مالك بن عوف بن عمرو بن عوف ,5.1.1.11.0,4.2.1.11.0,5.1.1.11.0
### |||| ومن حلفاء بني معاوية بن مالك ,5.1.1.12.0,4.2.1.12.0,5.1.1.12.0
### |||| ومن بني حنش بن عوف بن عمرو بن عوف وهم من أهل المسجد يعني مسجد قباء ,5.1.1.13.0,4.2.1.13.0,5.1.1.13.0
### |||| ومن بني جحجبا بن كلفة بن عوف بن عمرو بن عوف ,5.1.1.14.0,4.2.1.14.0,5.1.1.14.0
### |||| ومن بني أنيف بن جشم بن عائذ الله من بلي حلفاء بني جحجبا بن كلفة ,5.1.1.15.0,4.2.1.15.0,5.1.1.15.0
### |||| ومن بني ثعلبة بن عمرو بن عوف ,5.1.1.16.0,4.2.1.16.0,5.1.1.16.0
### |||| ومن بني غنم بن السلم بن امرئ القيس ,5.1.1.17.0,4.2.1.17.0,5.1.1.17.0
### |||| وشهد بدرا من الخزرج ثم من بني النجار ,5.1.1.18.0,4.2.1.18.0,5.1.1.18.0
### |||| فشهد بدرا من بني النجار ثم من بني مالك بن النجار ثم من بني غنم بن مالك بن النجار ,5.1.1.19.0,4.2.1.19.0,5.1.1.19.0
### |||| ومن حلفاء بني غنم بن مالك بن النجار ,5.1.1.20.0,4.2.1.20.0,5.1.1.20.0
### |||| ومن بني عمرو بن مالك بن النجار ثم من بني معاوية ابن عمرو وهم بنو حديلة وهي أم لهم. ,5.1.1.21.0,4.2.1.21.0,5.1.1.21.0
### |||| ومن بني مغالة. وهم من بني عمرو بن مالك بن النجار ,5.1.1.22.0,4.2.1.22.0,5.1.1.22.0
### |||| ومن بني مبذول وهو عامر بن مالك بن النجار ,5.1.1.23.0,4.2.1.23.0,5.1.1.23.0
### |||| ومن بني عدي بن النجار ,5.1.1.24.0,4.2.1.24.0,5.1.1.24.0
### |||| ومن حلفاء بني عدي بن النجار ,5.1.1.25.0,4.2.1.25.0,5.1.1.25.0
### |||| ومن بني مازن بن النجار ,5.1.1.26.0,4.2.1.26.0,5.1.1.26.0
### |||| ومن حلفاء بني مازن بن النجار ,5.1.1.27.0,4.2.1.27.0,5.1.1.27.0
### |||| ومن بني دينار بن النجار ,5.1.1.28.0,4.2.1.28.0,5.1.1.28.0
### |||| ومن حلفاء بني دينار بن النجار ,5.1.1.29.0,4.2.1.29.0,5.1.1.29.0
### |||| ومن بني الحارث بن الخزرج ثم من بني كعب بن الحارث بن الخزرج ,5.1.1.30.0,4.2.1.30.0,5.1.1.30.0
### |||| ومن بني جشم وزيد ابني الحارث بن الخزرج وكان يقال لهما التوأمان ودعوتهما واحدة في الديوان وهم أصحاب المسجد الذي بالسنح وهم أصحاب السنح خاصة ,5.1.1.31.0,4.2.1.31.0,5.1.1.31.0
### |||| ومن بني جدارة بن عوف بن الحارث بن الخزرج ,5.1.1.32.0,4.2.1.32.0,5.1.1.32.0
### |||| ومن بني الأبجر وهو خدرة بن عوف بن الحارث بن الخزرج ,5.1.1.33.0,4.2.1.33.0,5.1.1.33.0
### |||| ومن حلفاء بني الحارث بن الخزرج ,5.1.1.34.0,4.2.1.34.0,5.1.1.34.0
### |||| ومن بني  عوف بن الخزرج ثم من بلحبلى وهو سالم بن غنم بن عوف بن الخزرج وإنما سمي الحبلى لعظم بطنه ,5.1.1.35.0,4.2.1.35.0,5.1.1.35.0
### |||| ومن حلفاء بني سالم الحبلى بن غنم ,5.1.1.36.0,4.2.1.36.0,5.1.1.36.0
### |||| ومن القواقلة وهم بنو غنم وبنو سالم ابني عوف بن عمرو بن عوف بن الخزرج ,5.1.1.37.0,4.2.1.37.0,5.1.1.37.0
### |||| ومن حلفاء القواقلة من بني غضينة وهم بنو عمرو بن عمارة وغضينة أم لهم من بلي فنسبوا إليها ,5.1.1.38.0,4.2.1.38.0,5.1.1.38.0
### |||| ومن بني ساعدة بن كعب بن الخزرج بن الحارث بن الخزرج ,5.1.1.39.0,4.2.1.39.0,5.1.1.39.0
### |||| ومن حلفاء بني ساعدة بن كعب بن الخزرج ,5.1.1.40.0,4.2.1.40.0,5.1.1.40.0
### |||| ومن بني جشم بن الخزرج ثم من بني سلمة بن سعد بن علي بن أسد بن ساردة بن تزيد بن جشم ثم من بني حرام ابن كعب بن غنم بن كعب بن سلمة ,5.1.1.41.0,4.2.1.41.0,5.1.1.41.0
### |||| ومن موالي بني حرام بن كعب ,5.1.1.42.0,4.2.1.42.0,5.1.1.42.0
### |||| ومن بني عبيد بن عدي بن غنم بن كعب بن سلمة وهم دعوة على حدة ,5.1.1.43.0,4.2.1.43.0,5.1.1.43.0
### |||| ومن حلفاء بني عبيد بن عدي ومواليهم ,5.1.1.44.0,4.2.1.44.0,5.1.1.44.0
### |||| ومن بني سواد بن غنم بن كعب بن سلمة ,5.1.1.45.0,4.2.1.45.0,5.1.1.45.0
### |||| ومن سائر بني سلمة ,5.1.1.46.0,4.2.1.46.0,5.1.1.46.0
### |||| ومن بني زريق بن عامر بن زريق بن عبد بن حارثة ابن مالك بن غضب بن جشم بن الخزرج ,5.1.1.47.0,4.2.1.47.0,5.1.1.47.0
### |||| ومن بني بياضة بن عامر بن زريق بن عبد حارثة بن مالك ابن غضب بن جشم بن الخزرج ,5.1.1.48.0,4.2.1.48.0,5.1.1.48.0
### |||| ومن بني حبيب بن عبد حارثة بن مالك بن غضب ابن جشم بن الخزرج ,5.1.1.49.0,4.2.1.49.0,5.1.1.49.0
